{
  "$schema": "https://json-schema.org/draft/2020-12/schema",
  "$id": "https://openelis-global.org/contracts/analyzer/v1/portable-profile.schema.json",
  "title": "OpenELIS Analyzer Bridge portable profile v1",
  "type": "object",
  "additionalProperties": false,
  "required": [
    "schemaVersion",
    "profileId",
    "revision",
    "revisionFingerprint",
    "displayName",
    "source",
    "status",
    "protocol",
    "capabilities",
    "tests",
    "controlResultRecognition"
  ],
  "properties": {
    "schemaVersion": { "const": "1.0" },
    "profileId": { "type": "string", "pattern": "^[a-z0-9][a-z0-9._-]+$" },
    "revision": { "type": "integer", "minimum": 1 },
    "revisionFingerprint": { "$ref": "#/$defs/fingerprint" },
    "displayName": { "type": "string", "minLength": 1 },
    "source": { "enum": ["SHIPPED", "SITE"] },
    "status": { "enum": ["ACTIVE", "INACTIVE"] },
    "lineage": {
      "type": "object",
      "additionalProperties": false,
      "required": ["parentProfileId", "parentRevision"],
      "properties": {
        "parentProfileId": { "type": "string", "minLength": 1 },
        "parentRevision": { "type": "integer", "minimum": 1 }
      }
    },
    "protocol": { "enum": ["ASTM", "HL7", "FILE"] },
    "capabilities": {
      "type": "object",
      "additionalProperties": false,
      "required": ["inboundResults", "outboundOrders", "connectionTest"],
      "properties": {
        "inboundResults": { "const": true },
        "outboundOrders": { "type": "boolean" },
        "connectionTest": { "type": "boolean" }
      }
    },
    "identity": {
      "type": "object",
      "additionalProperties": false,
      "properties": {
        "senderPattern": { "type": "string", "minLength": 1 },
        "manufacturer": { "type": "string", "minLength": 1 },
        "model": { "type": "string", "minLength": 1 }
      }
    },
    "tests": { "type": "array", "items": { "$ref": "#/$defs/testDefinition" } },
    "controlResultRecognition": {
      "$ref": "#/$defs/controlResultRecognition"
    },
    "file": { "$ref": "#/$defs/fileDefinition" }
  },
  "allOf": [
    {
      "if": {
        "properties": { "protocol": { "const": "FILE" } },
        "required": ["protocol"]
      },
      "then": { "required": ["file"] }
    },
    {
      "if": {
        "properties": { "protocol": { "const": "ASTM" } },
        "required": ["protocol"]
      },
      "then": {
        "$ref": "#/$defs/astmRecognitionFields"
      }
    },
    {
      "if": {
        "properties": { "protocol": { "const": "HL7" } },
        "required": ["protocol"]
      },
      "then": {
        "$ref": "#/$defs/hl7RecognitionFields"
      }
    },
    {
      "if": {
        "properties": { "protocol": { "const": "FILE" } },
        "required": ["protocol"]
      },
      "then": {
        "$ref": "#/$defs/fileRecognitionFields"
      }
    }
  ],
  "$defs": {
    "fingerprint": {
      "type": "string",
      "pattern": "^sha256:[0-9a-f]{64}$"
    },
    "coding": {
      "type": "object",
      "additionalProperties": false,
      "required": ["system", "code"],
      "properties": {
        "system": { "type": "string", "format": "uri" },
        "code": { "type": "string", "minLength": 1 },
        "display": { "type": "string", "minLength": 1 }
      }
    },
    "resultValue": {
      "type": "object",
      "additionalProperties": false,
      "required": ["rawValue", "displayName"],
      "properties": {
        "rawValue": { "type": "string", "minLength": 1 },
        "displayName": { "type": "string", "minLength": 1 },
        "normalizedCoding": { "$ref": "#/$defs/coding" }
      }
    },
    "testDefinition": {
      "type": "object",
      "additionalProperties": false,
      "required": [
        "sourceRowKey",
        "analyzerCode",
        "displayName",
        "resultType",
        "resultValues"
      ],
      "properties": {
        "sourceRowKey": { "type": "string", "minLength": 1 },
        "analyzerCode": { "type": "string", "minLength": 1 },
        "aliases": {
          "type": "array",
          "items": { "type": "string", "minLength": 1 },
          "uniqueItems": true
        },
        "displayName": { "type": "string", "minLength": 1 },
        "resultType": { "enum": ["NUMERIC", "QUALITATIVE", "TEXT"] },
        "normalizedCoding": { "$ref": "#/$defs/coding" },
        "resultValues": {
          "type": "array",
          "items": { "$ref": "#/$defs/resultValue" }
        }
      }
    },
    "controlResultRecognition": {
      "oneOf": [
        {
          "type": "object",
          "additionalProperties": false,
          "required": ["mode", "recognitionFingerprint", "rules"],
          "properties": {
            "mode": { "const": "RULES" },
            "recognitionFingerprint": { "$ref": "#/$defs/fingerprint" },
            "rules": {
              "type": "object",
              "minProperties": 1,
              "propertyNames": { "pattern": ".*\\S.*" },
              "additionalProperties": {
                "$ref": "#/$defs/controlRecognitionRule"
              }
            }
          }
        },
        {
          "type": "object",
          "additionalProperties": false,
          "required": [
            "mode",
            "recognitionFingerprint",
            "affirmedNoControlResults"
          ],
          "properties": {
            "mode": { "const": "NONE" },
            "recognitionFingerprint": { "$ref": "#/$defs/fingerprint" },
            "affirmedNoControlResults": { "const": true }
          }
        }
      ]
    },
    "controlRecognitionRule": {
      "type": "object",
      "additionalProperties": false,
      "required": ["ruleType", "operand"],
      "properties": {
        "ruleType": {
          "enum": [
            "SPECIMEN_ID_PREFIX",
            "SPECIMEN_ID_PATTERN",
            "FIELD_EQUALS",
            "FIELD_CONTAINS"
          ]
        },
        "targetField": { "type": "string", "pattern": ".*\\S.*" },
        "operand": { "type": "string", "pattern": ".*\\S.*" },
        "controlLevel": { "type": "string", "pattern": ".*\\S.*" },
        "controlType": { "type": "string", "pattern": ".*\\S.*" }
      },
      "allOf": [
        {
          "if": {
            "properties": {
              "ruleType": { "enum": ["FIELD_EQUALS", "FIELD_CONTAINS"] }
            },
            "required": ["ruleType"]
          },
          "then": { "required": ["targetField"] }
        },
        {
          "if": {
            "properties": {
              "ruleType": {
                "enum": ["SPECIMEN_ID_PREFIX", "SPECIMEN_ID_PATTERN"]
              }
            },
            "required": ["ruleType"]
          },
          "then": { "not": { "required": ["targetField"] } }
        }
      ]
    },
    "astmRecognitionFields": {
      "properties": {
        "controlResultRecognition": {
          "properties": {
            "rules": {
              "additionalProperties": {
                "if": {
                  "properties": {
                    "ruleType": {
                      "enum": ["FIELD_EQUALS", "FIELD_CONTAINS"]
                    }
                  },
                  "required": ["ruleType"]
                },
                "then": {
                  "properties": {
                    "targetField": {
                      "pattern": "^[A-Z][0-9]?\\.[1-9][0-9]*(?:\\.[1-9][0-9]*){0,2}$"
                    }
                  }
                }
              }
            }
          }
        }
      }
    },
    "hl7RecognitionFields": {
      "properties": {
        "controlResultRecognition": {
          "properties": {
            "rules": {
              "additionalProperties": {
                "if": {
                  "properties": {
                    "ruleType": {
                      "enum": ["FIELD_EQUALS", "FIELD_CONTAINS"]
                    }
                  },
                  "required": ["ruleType"]
                },
                "then": {
                  "properties": {
                    "targetField": {
                      "pattern": "^[A-Z0-9]{3}\\.[1-9][0-9]*(?:\\.[1-9][0-9]*){0,2}$"
                    }
                  }
                }
              }
            }
          }
        }
      }
    },
    "fileRecognitionFields": {
      "properties": {
        "controlResultRecognition": {
          "properties": {
            "rules": {
              "additionalProperties": {
                "if": {
                  "properties": {
                    "ruleType": {
                      "enum": ["FIELD_EQUALS", "FIELD_CONTAINS"]
                    }
                  },
                  "required": ["ruleType"]
                },
                "then": {
                  "properties": {
                    "targetField": { "const": "QC_TASK" }
                  }
                }
              }
            }
          }
        }
      }
    },
    "fileDefinition": {
      "type": "object",
      "additionalProperties": false,
      "required": ["format", "filePattern", "columnMappings"],
      "properties": {
        "format": { "enum": ["CSV", "TSV", "XLS", "XLSX", "ODS"] },
        "filePattern": { "type": "string", "minLength": 1 },
        "delimiter": { "type": "string", "minLength": 1, "maxLength": 1 },
        "skipRows": { "type": "integer", "minimum": 0 },
        "columnMappings": {
          "type": "object",
          "minProperties": 1,
          "additionalProperties": {
            "enum": [
              "sampleId",
              "testCode",
              "result",
              "units",
              "interpretation",
              "qcTask",
              "testDate",
              "ctValue"
            ]
          }
        }
      }
    }
  }
}
